{
  "$schema": "https://json-schema.org/draft/2020-12/schema",
  "$id": "https://raw.githubusercontent.com/liangboqiang/TjuaeHub/main/schemas/mcp-definition.v1.schema.json",
  "version": "1.0.0",
  "title": "Tjuae MCP Definition v1",
  "description": "可共享的 MCP 服务定义。配置字段只声明 transport 对应的环境变量或请求头绑定；实际值、账号、凭据、本机路径与实例 URL 属于 Core Overlay，不得写入此文件。",
  "type": "object",
  "required": ["$schema", "schemaVersion", "kind", "id", "runtimeId", "displayName", "transport"],
  "additionalProperties": false,
  "properties": {
    "$schema": {
      "const": "https://raw.githubusercontent.com/liangboqiang/TjuaeHub/main/schemas/mcp-definition.v1.schema.json"
    },
    "schemaVersion": { "const": 1 },
    "kind": { "const": "mcp" },
    "id": { "$ref": "#/$defs/AssetLocalId" },
    "runtimeId": { "$ref": "#/$defs/AssetLocalId" },
    "displayName": { "type": "string", "minLength": 1, "maxLength": 128 },
    "description": { "type": "string", "maxLength": 2048 },
    "transport": { "$ref": "#/$defs/McpTransport" },
    "capabilities": { "$ref": "#/$defs/McpCapabilities" },
    "configurationSchema": { "$ref": "#/$defs/ConfigurationSchema" }
  },
  "allOf": [
    {
      "if": {
        "properties": { "transport": { "properties": { "type": { "const": "stdio" } } } },
        "required": ["transport"]
      },
      "then": {
        "properties": {
          "configurationSchema": {
            "properties": {
              "fields": {
                "items": {
                  "properties": {
                    "binding": {
                      "properties": {
                        "target": { "const": "environment" },
                        "name": { "pattern": "^[A-Za-z_][A-Za-z0-9_]*$" }
                      }
                    }
                  }
                }
              }
            }
          }
        }
      },
      "else": {
        "properties": {
          "configurationSchema": {
            "properties": {
              "fields": {
                "items": {
                  "properties": {
                    "binding": { "properties": { "target": { "const": "header" } } }
                  }
                }
              }
            }
          }
        }
      }
    }
  ],
  "$defs": {
    "AssetLocalId": {
      "type": "string",
      "pattern": "^[a-z0-9]+(?:[._:-][a-z0-9]+)*$",
      "minLength": 1,
      "maxLength": 128
    },
    "PortableArgument": {
      "type": "string",
      "minLength": 1,
      "maxLength": 512,
      "pattern": "^(?!.*(?:^|[=/\\\\])(?:Users|home|Documents and Settings)[/\\\\])(?![A-Za-z]:[/\\\\])(?!/)(?!\\\\\\\\)[^\\u0000-\\u001f]+$"
    },
    "NpmPackage": {
      "type": "object",
      "required": ["ecosystem", "name", "version", "runner"],
      "additionalProperties": false,
      "properties": {
        "ecosystem": { "const": "npm" },
        "name": {
          "type": "string",
          "pattern": "^(?:@[a-z0-9][a-z0-9._-]*/)?[a-z0-9][a-z0-9._-]*$",
          "maxLength": 214
        },
        "version": {
          "type": "string",
          "pattern": "^(0|[1-9]\\d*)\\.(0|[1-9]\\d*)\\.(0|[1-9]\\d*)(?:-(?:0|[1-9]\\d*|\\d*[A-Za-z-][0-9A-Za-z-]*)(?:\\.(?:0|[1-9]\\d*|\\d*[A-Za-z-][0-9A-Za-z-]*))*)?(?:\\+[0-9A-Za-z-]+(?:\\.[0-9A-Za-z-]+)*)?$"
        },
        "runner": { "type": "string", "enum": ["bunx", "npx"] }
      }
    },
    "StdioTransport": {
      "type": "object",
      "required": ["type", "package"],
      "additionalProperties": false,
      "properties": {
        "type": { "const": "stdio" },
        "package": { "$ref": "#/$defs/NpmPackage" },
        "arguments": {
          "type": "array",
          "maxItems": 64,
          "items": { "$ref": "#/$defs/PortableArgument" }
        }
      }
    },
    "RemoteTransport": {
      "type": "object",
      "required": ["type"],
      "additionalProperties": false,
      "properties": {
        "type": { "type": "string", "enum": ["sse", "streamableHttp"] }
      }
    },
    "McpTransport": {
      "oneOf": [{ "$ref": "#/$defs/StdioTransport" }, { "$ref": "#/$defs/RemoteTransport" }]
    },
    "McpCapabilities": {
      "type": "object",
      "additionalProperties": false,
      "properties": {
        "tools": { "type": "boolean" },
        "resources": { "type": "boolean" },
        "prompts": { "type": "boolean" },
        "sampling": { "type": "boolean" },
        "logging": { "type": "boolean" },
        "completions": { "type": "boolean" }
      }
    },
    "ConfigurationField": {
      "type": "object",
      "required": ["key", "label", "valueType", "required", "secret", "binding"],
      "additionalProperties": false,
      "properties": {
        "key": {
          "type": "string",
          "pattern": "^[A-Za-z][A-Za-z0-9._-]*$",
          "maxLength": 128
        },
        "label": { "type": "string", "minLength": 1, "maxLength": 128 },
        "description": { "type": "string", "maxLength": 1024 },
        "valueType": { "type": "string", "enum": ["string", "number", "boolean"] },
        "required": { "type": "boolean" },
        "secret": { "type": "boolean" },
        "binding": {
          "type": "object",
          "required": ["target", "name"],
          "additionalProperties": false,
          "properties": {
            "target": { "type": "string", "enum": ["environment", "header"] },
            "name": {
              "type": "string",
              "pattern": "^[!#$%&'*+.^_`|~0-9A-Za-z-]+$",
              "maxLength": 256
            }
          }
        }
      }
    },
    "ConfigurationSchema": {
      "type": "object",
      "required": ["fields"],
      "additionalProperties": false,
      "properties": {
        "fields": {
          "type": "array",
          "maxItems": 64,
          "items": { "$ref": "#/$defs/ConfigurationField" }
        }
      }
    }
  }
}
